{
  "args": {},
  "data": {
    "title": "Test Post Request with Body Data",
    "description": "Test Description",
    "date": "2020-03-03T00:00:00.000Z"
  },
  "files": {},
  "form": {},
  "headers": {
    "x-forwarded-proto": "https",
    "host": "postman-echo.com",
    "content-length": "111",
    "content-type": "application/json",
    "x-forwarded-port": "443"
  },
  "json": {
    "title": "Test Post Request with Body Data",
    "description": "Test Description",
    "date": "2020-03-03T00:00:00.000Z"
  },
  "url": "https://postman-echo.com/post"
}